{
  "type": "sprite",
  "src": "elementals.gif",
  "sheetSize": [64, 128],
  "tileSize": [16, 18],
  "hotspotOffset": [0.5, 0.5, 0],
  "frames": {
    "N": [
      [0, 54],
      [16, 54],
      [32, 54],
      [48, 54]
    ],
    "E": [
      [0, 72],
      [16, 72],
      [32, 72],
      [16, 72]
    ],
    "S": [
      [0, 90],
      [16, 90],
      [32, 90],
      [16, 90]
    ],
    "W": [
      [48, 54],
      [48, 72],
      [48, 90],
      [48, 72]
    ]
  },
  "drawOffset": {
    "N": [0, 1, 0.2],
    "E": [0, 1, 0.2],
    "S": [0, 1, 0.2],
    "W": [0, 1, 0.2],
    "NW": [0, 1, 0.2],
    "NE": [0, 1, 0.2],
    "SW": [0, 1, 0.2],
    "SE": [0, 1, 0.2]
  },
  "bindCamera": false,
  "enableSpeech": true,
  "state": "intro"
}
