{
  "frames": {
    "E": [
      [
        0,
        0
      ]
    ],
    "N": [
      [
        0,
        0
      ]
    ],
    "S": [
      [
        0,
        0
      ]
    ],
    "W": [
      [
        0,
        0
      ]
    ]
  },
  "sheetSize": [
    32,
    32
  ],
  "src": "placeholder.png",
  "tileSize": [
    32,
    32
  ],
  "type": "avatar",
  "hotspotOffset": [
    0.5,
    0.5,
    0
  ],
  "drawOffset": {
    "E": [
      -0.25,
      -0.15,
      -1
    ],
    "N": [
      -0.25,
      -0.15,
      -1
    ],
    "S": [
      -0.25,
      -0.15,
      -1
    ],
    "W": [
      -0.25,
      -0.15,
      -1
    ]
  }
}